{
  "schema_version": "1.0.0",
  "thesis_diff_id": "baba-diff-2024-05-14",
  "company_id": "alibaba-group",
  "base_thesis_id": "baba-core-thesis",
  "base_version_id": "baba-thesis-v1-2024-02-07",
  "source_document_ids": [
    "baba-results-2024-02-07",
    "baba-results-2024-05-14"
  ],
  "material_published_on": "2024-05-14",
  "analysis_cutoff_at": "2024-05-15T00:00:00Z",
  "generated_at": "2024-05-15T00:00:00Z",
  "overall_assessment": "slightly_strengthened",
  "overall_rationale": "淘天的双位数 GMV 与订单增长、客户管理收入增长和 88VIP 增加，以及云核心公共云产品增长和调整后 EBITA 提升，分别对两项核心假设形成正面验证；但淘天整体货币化率下降、AIDC 亏损扩大和自由现金流下降 52% 显示增长仍依赖投入。正负证据并存，核心业务改善的证据略占上风，但不足以判定明显增强。",
  "assumption_changes": [
    {
      "assumption_id": "baba-a1-commerce",
      "prior_statement": "淘天的用户优先与价格竞争策略能够持续提升购买人数、订单和高价值会员，并最终转化为客户管理收入，而不会造成长期的货币化率及分部利润恶化。",
      "impact": "slightly_strengthened",
      "confidence": "medium",
      "evidence_ids": [
        "baba-new-commerce-revenue",
        "baba-new-commerce-engagement",
        "baba-new-commerce-take-rate",
        "baba-new-commerce-take-rate-explanation",
        "baba-new-commerce-ebita",
        "baba-new-commerce-ebita-explanation"
      ],
      "rationale": "双位数 GMV 与订单增长、购买人数和频次提升、88VIP 超过 3500 万以及客户管理收入增长 5%，验证了用户参与度与初步变现；不过整体货币化率下降且调整后 EBITA 同比下降 1%，因此仅评为小幅增强。",
      "alternative_explanation": "用户增长和客户管理收入改善可能来自短期价格投入、流量倾斜或较低货币化的新模式；在分部利润恢复前，不能证明新增活跃具备长期经济价值。"
    },
    {
      "assumption_id": "baba-a2-cloud",
      "prior_statement": "云智能减少低毛利项目制收入、聚焦公共云与 AI 后，收入质量和盈利能力会改善，并能逐步恢复可持续的外部客户增长。",
      "impact": "slightly_strengthened",
      "confidence": "high",
      "evidence_ids": ["baba-new-cloud"],
      "rationale": "核心公共云产品收入同比双位数增长，云调整后 EBITA 同比增长 45%，与产品结构及效率改善方向一致；但云总收入仅增长 3%，剔除阿里并表子公司后的收入仍略降，因此只是小幅增强。",
      "alternative_explanation": "利润增长可能主要来自成本效率和项目退出，而非外部客户需求的持续扩张；需要外部客户收入转正才能区分结构优化与真实增长。"
    },
    {
      "assumption_id": "baba-a3-international",
      "prior_statement": "AIDC 的订单和收入高增长能够形成规模效应，使新增投入最终表现为单位经济性改善和调整后 EBITA 亏损收窄。",
      "impact": "slightly_weakened",
      "confidence": "high",
      "evidence_ids": ["baba-new-aidc-growth", "baba-new-aidc-loss"],
      "rationale": "AIDC 收入增长 45%、订单增长 20%，但调整后 EBITA 亏损从人民币 21.71 亿元扩大至 40.85 亿元；规模增长尚未转化为本期亏损收窄，直接削弱该假设。",
      "alternative_explanation": "亏损扩大可能是进入新市场和建设跨境履约能力的前置投入，若未来单位订单亏损下降则本期弱化可能是暂时的。"
    },
    {
      "assumption_id": "baba-a4-capital-allocation",
      "prior_statement": "经营现金流和资产负债表能够同时支持核心业务投入与持续回购，并在股权激励后带来流通股净减少，而不显著削弱财务弹性。",
      "impact": "unchanged",
      "confidence": "medium",
      "evidence_ids": [
        "baba-new-free-cash-flow",
        "baba-new-free-cash-flow-explanation",
        "baba-new-buyback"
      ],
      "rationale": "财年回购 125 亿美元且 3 月季度流通股净减少 2.6%，说明回购确实抵消了股权激励稀释；但季度自由现金流同比下降 52%，其中多数新增资本开支投向阿里云基础设施。股数改善与现金压力相互抵消，暂评基本不变。",
      "alternative_explanation": "自由现金流同比下降部分来自上年同期蚂蚁集团特别股息的高基数，未必代表经常性现金能力同比恶化；同时云基础设施投入可能带来后续回报。"
    }
  ],
  "management_statement_action": {
    "assessment": "partially_aligned",
    "summary": "管理层此前承诺增加淘天用户体验投入并聚焦公共云，本期披露显示相应投入与产品方向已发生，且用户参与度、公共云产品和云利润有改善；但淘天利润、外部云收入与投入回报仍未完全验证。",
    "comparisons": [
      {
        "comparison_id": "baba-mc1-commerce-investment",
        "past_statement": "管理层表示将增加投入改善淘天用户核心体验。",
        "past_evidence_ids": ["baba-base-management-investment-plan"],
        "current_action_or_result": "用户体验与技术投入增加，购买人数、频次和 88VIP 改善，但淘天调整后 EBITA 同比下降。",
        "current_evidence_ids": [
          "baba-new-commerce-engagement",
          "baba-new-commerce-ebita",
          "baba-new-commerce-ebita-explanation"
        ],
        "assessment": "partially_aligned",
        "unresolved_part": "尚无法证明用户体验投入能在货币化率下降的情况下形成持续利润回报。"
      },
      {
        "comparison_id": "baba-mc2-public-cloud-focus",
        "past_statement": "管理层表示将聚焦公共云产品并减少低毛利项目制合同。",
        "past_evidence_ids": [
          "baba-base-management-investment-plan",
          "baba-base-cloud",
          "baba-base-cloud-quality-explanation"
        ],
        "current_action_or_result": "核心公共云产品收入同比双位数增长，云调整后 EBITA 同比增长 45%，但剔除并表子公司的收入仍略降。",
        "current_evidence_ids": ["baba-new-cloud"],
        "assessment": "partially_aligned",
        "unresolved_part": "外部客户收入何时恢复增长，以及盈利改善中产品结构和成本效率各自贡献，仍未披露。"
      }
    ]
  },
  "targeted_counter_case": {
    "argument": "本期改善可能是以更低货币化和更高投入换取的表面增长：淘天 GMV 增长伴随整体货币化率下降及调整后 EBITA 下滑，AIDC 高增长伴随亏损扩大，云基础设施投入又压低自由现金流；若这些趋势持续，核心假设中的增长质量和资本回报将同时失效。",
    "attacked_assumption_ids": [
      "baba-a1-commerce",
      "baba-a2-cloud",
      "baba-a3-international",
      "baba-a4-capital-allocation"
    ],
    "evidence_ids": [
      "baba-new-commerce-take-rate",
      "baba-new-commerce-ebita",
      "baba-new-aidc-loss",
      "baba-new-free-cash-flow",
      "baba-new-free-cash-flow-explanation"
    ],
    "why_plausible": "四项负面数据来自同一官方披露期，且分别触及变现、分部盈利、国际单位经济性和现金转化，不是与论点无关的通用风险。"
  },
  "follow_up_questions": [
    {
      "question_id": "baba-q1-commerce-monetization",
      "question": "在 GMV 增量偏向淘宝商家和低货币化新模式后，未来两个季度客户管理收入能否连续快于 GMV，以证明整体货币化率已企稳？",
      "linked_assumption_ids": ["baba-a1-commerce"],
      "information_value": "若客户管理收入持续快于 GMV，可把用户参与改善升级为经济性改善；反之将强化增长由低货币化供给驱动的反方。",
      "evidence_needed": "后续季度线上 GMV、客户管理收入、整体货币化率和淘天调整后 EBITA 的同口径披露。"
    },
    {
      "question_id": "baba-q2-cloud-external-growth",
      "question": "剔除阿里并表子公司后，核心公共云与 AI 产品增长何时足以使外部客户收入恢复正增长，同时维持调整后 EBITA 改善？",
      "linked_assumption_ids": ["baba-a2-cloud"],
      "information_value": "该问题能区分结构退出和成本效率带来的利润增长，还是可持续的外部客户需求与收入质量提升。",
      "evidence_needed": "外部客户收入增速、核心公共云与 AI 收入增速、项目制收入退出规模及云调整后 EBITA 利润率。"
    },
    {
      "question_id": "baba-q3-aidc-unit-economics",
      "question": "AIDC 本期亏损扩大中有多少来自一次性市场扩张，Choice 的每单履约亏损何时随订单规模下降？",
      "linked_assumption_ids": ["baba-a3-international"],
      "information_value": "单位订单亏损若下降可支持规模效应；若订单增长继续伴随每单亏损不改善，国际业务假设会进一步削弱。",
      "evidence_needed": "AIDC 分业务投入、每单履约成本、获客成本、贡献利润及调整后 EBITA 的连续季度数据。"
    }
  ],
  "proposed_patch": {
    "patch_status": "pending_user_review",
    "base_thesis_id": "baba-core-thesis",
    "base_version_id": "baba-thesis-v1-2024-02-07",
    "change_items": [
      {
        "change_id": "baba-change-one-sentence",
        "operation": "modify",
        "target_type": "one_sentence_thesis",
        "target_id": null,
        "summary": "加入核心业务小幅正面验证与仍待确认的三项约束。",
        "rationale": "正负证据并存，避免把用户与收入增长自动解释为整体商业质量显著改善。",
        "evidence_ids": ["baba-new-commerce-revenue", "baba-new-cloud", "baba-new-aidc-loss", "baba-new-free-cash-flow"]
      },
      {
        "change_id": "baba-change-a1",
        "operation": "modify",
        "target_type": "assumption",
        "target_id": "baba-a1-commerce",
        "summary": "确认用户参与改善，同时把货币化率和分部利润列为后续验证条件。",
        "rationale": "GMV、订单、会员和客户管理收入改善，但货币化率与调整后 EBITA 仍承压。",
        "evidence_ids": [
          "baba-new-commerce-revenue",
          "baba-new-commerce-engagement",
          "baba-new-commerce-take-rate",
          "baba-new-commerce-take-rate-explanation",
          "baba-new-commerce-ebita",
          "baba-new-commerce-ebita-explanation"
        ]
      },
      {
        "change_id": "baba-change-a2",
        "operation": "modify",
        "target_type": "assumption",
        "target_id": "baba-a2-cloud",
        "summary": "确认公共云产品和盈利改善，保留外部客户增长验证条件。",
        "rationale": "核心公共云产品双位数增长且调整后 EBITA 增长 45%，但剔除并表子公司的收入仍略降。",
        "evidence_ids": ["baba-new-cloud"]
      },
      {
        "change_id": "baba-change-a3",
        "operation": "modify",
        "target_type": "assumption",
        "target_id": "baba-a3-international",
        "summary": "把规模效应从预期改为尚未成立的待验证判断。",
        "rationale": "收入和订单高增长同时伴随调整后 EBITA 亏损明显扩大。",
        "evidence_ids": ["baba-new-aidc-growth", "baba-new-aidc-loss"]
      },
      {
        "change_id": "baba-change-a4",
        "operation": "modify",
        "target_type": "assumption",
        "target_id": "baba-a4-capital-allocation",
        "summary": "同时记录净股数下降与云资本开支造成的自由现金流压力。",
        "rationale": "回购有效抵消稀释，但自由现金流同比下降 52%，资本配置持续性尚待正常化数据。",
        "evidence_ids": [
          "baba-new-buyback",
          "baba-new-free-cash-flow",
          "baba-new-free-cash-flow-explanation"
        ]
      },
      {
        "change_id": "baba-change-counter-case",
        "operation": "modify",
        "target_type": "strongest_counter_case",
        "target_id": null,
        "summary": "用同一期变现、利润、国际亏损与现金流数据构建针对性反方。",
        "rationale": "反方直接攻击四项假设的经济回报，而非使用通用竞争风险模板。",
        "evidence_ids": [
          "baba-new-commerce-take-rate",
          "baba-new-commerce-ebita",
          "baba-new-aidc-loss",
          "baba-new-free-cash-flow",
          "baba-new-free-cash-flow-explanation"
        ]
      },
      {
        "change_id": "baba-change-question-commerce",
        "operation": "modify",
        "target_type": "unknown_question",
        "target_id": "baba-uq1-commerce-conversion",
        "summary": "把淘天未知项收敛为货币化率能否持续企稳的问题。",
        "rationale": "连续两个季度的客户管理收入与 GMV 关系能够改变淘天小幅增强的判断。",
        "evidence_ids": [
          "baba-new-commerce-take-rate",
          "baba-new-commerce-take-rate-explanation"
        ]
      },
      {
        "change_id": "baba-change-question-cloud",
        "operation": "modify",
        "target_type": "unknown_question",
        "target_id": "baba-uq2-cloud-external",
        "summary": "把云未知项收敛为外部客户增长与盈利能否同时改善的问题。",
        "rationale": "该答案能够区分公共云产品改善与并表口径造成的收入质量噪音。",
        "evidence_ids": [
          "baba-new-cloud"
        ]
      },
      {
        "change_id": "baba-change-question-aidc",
        "operation": "modify",
        "target_type": "unknown_question",
        "target_id": "baba-uq3-aidc-unit-economics",
        "summary": "把国际业务未知项收敛为新增投入与单位经济性的问题。",
        "rationale": "单位订单亏损能否下降将直接改变国际规模效应尚未成立的判断。",
        "evidence_ids": [
          "baba-new-aidc-loss"
        ]
      }
    ],
    "proposed_thesis":
      {
        "schema_version": "1.0.0",
        "thesis_id": "baba-core-thesis",
        "company": {